Rank,Song,Artist,Year,Source,Decade,Genres,Popularity
,Wild as You,Cody Johnson,2016,Artist Top Tracks,2010s,"classic texas country, contemporary country, modern country pop",65.0
,Glittery - From The Kacey Musgraves Christmas Show,Kacey Musgraves,2019,Artist Top Tracks,2010s,"classic texas country, contemporary country, country dawn",65.0
,Slow Burn,Kacey Musgraves,2018,Artist Top Tracks,2010s,"classic texas country, contemporary country, country dawn",65.0
,(What A) Wonderful World,Sam Cooke,2015,Artist Top Tracks,2010s,"classic soul, soul, vocal jazz",65.0
,Mercy Mercy Me (The Ecology),Marvin Gaye,1971,Artist Top Tracks,1970s,"classic soul, motown, neo soul, northern soul, quiet storm, soul",65.0
,(You Make Me Feel Like) A Natural Woman,Aretha Franklin,1968,Artist Top Tracks,1960s,"classic soul, jazz blues, memphis soul, soul, southern soul, vocal jazz",65.0
,Blowin' in the Wind,Bob Dylan,1963,Artist Top Tracks,1960s,"classic rock, country rock, folk, folk rock, rock, roots rock, singer-songwriter",65.0
,Texas,Blake Shelton,2024,Artist Top Tracks,2020s,"classic oklahoma country, contemporary country, country, country road",65.0
,That's What You Get,Paramore,2007,Artist Top Tracks,2000s,"candy pop, modern rock, pixie, pop, pop emo, pop punk, rock",65.0
,Guns and Ships,Leslie Odom Jr.,2015,Artist Top Tracks,2010s,"broadway, show tunes, vocal jazz",65.0
,The Room Where It Happens,Leslie Odom Jr.,2015,Artist Top Tracks,2010s,"broadway, show tunes, vocal jazz",65.0
,He Can Only Hold Her,Amy Winehouse,2006,Artist Top Tracks,2000s,"british soul, neo soul",65.0
,Hey Jude - 2015 Mix,The Beatles,2023,Artist Top Tracks,2020s,"british invasion, classic rock, merseybeat, psychedelic rock, rock",65.0
,Where Them Girls At (feat. Nicki Minaj & Flo Rida),David Guetta,2011,Artist Top Tracks,2010s,"big room, dance pop, edm, pop, pop dance",65.0
,Sexy Bitch (feat. Akon),David Guetta,2009,Artist Top Tracks,2000s,"big room, dance pop, edm, pop, pop dance",65.0
,Outside Today,YoungBoy Never Broke Again,2018,Artist Top Tracks,2010s,"baton rouge rap, rap",65.0
,Through the Storm,YoungBoy Never Broke Again,2018,Artist Top Tracks,2010s,"baton rouge rap, rap",65.0
,DIE FOR ME,Chase Atlantic,2024,Artist Top Tracks,2020s,alternative r&b,65.0
,BULLFROG,Doechii,2024,Artist Top Tracks,2020s,alternative r&b,65.0
,How Much Is Weed?,Dominic Fike,2023,Artist Top Tracks,2020s,"alternative pop rock, pov: indie",65.0
,Ronald,Falling In Reverse,2024,Artist Top Tracks,2020s,"alternative metal, rap metal",65.0
,All I Want,A Day To Remember,2010,Artist Top Tracks,2010s,"alternative metal, metalcore, neon pop punk, pop punk, screamo",65.0
,Word Up!,Korn,2004,Artist Top Tracks,2000s,"alternative metal, funk metal, hard rock, nu metal, post-grunge, rap metal, rock",65.0
,Y'all Want a Single,Korn,2003,Artist Top Tracks,2000s,"alternative metal, funk metal, hard rock, nu metal, post-grunge, rap metal, rock",65.0
,A.D.I.D.A.S.,Korn,1996,Artist Top Tracks,1990s,"alternative metal, funk metal, hard rock, nu metal, post-grunge, rap metal, rock",65.0
,Time of Dying,Three Days Grace,2006,Artist Top Tracks,2000s,"alternative metal, canadian metal, canadian rock, nu metal, post-grunge, rock",65.0
,Pain,Three Days Grace,2006,Artist Top Tracks,2000s,"alternative metal, canadian metal, canadian rock, nu metal, post-grunge, rock",65.0
,Just Like You,Three Days Grace,2003,Artist Top Tracks,2000s,"alternative metal, canadian metal, canadian rock, nu metal, post-grunge, rock",65.0
,Everlong - Acoustic Version,Foo Fighters,2009,Artist Top Tracks,2000s,"alternative metal, alternative rock, modern rock, permanent wave, post-grunge, rock",65.0
,Times Like These,Foo Fighters,2002,Artist Top Tracks,2000s,"alternative metal, alternative rock, modern rock, permanent wave, post-grunge, rock",65.0
,"Tonight, Tonight - Remastered 2012",The Smashing Pumpkins,1995,Artist Top Tracks,1990s,"alternative metal, alternative rock, grunge, permanent wave, rock, spacegrunge",65.0
,Down In A Hole (2022 Remaster),Alice In Chains,1992,Artist Top Tracks,1990s,"alternative metal, alternative rock, grunge, hard rock, nu metal, rock",65.0
,November Has Come,Gorillaz,2005,Artist Top Tracks,2000s,"alternative hip hop, modern rock, rock",65.0
,Call Your Mom (with Lizzy McAlpine),Noah Kahan,2024,Artist Top Tracks,2020s,"alt z, boston folk, indie pop, singer-songwriter pop",65.0
,hate to be lame,Lizzy McAlpine,2022,Artist Top Tracks,2020s,"alt z, boston folk, indie pop, singer-songwriter pop",65.0
,Tush (2006 Remaster),ZZ Top,1975,Artist Top Tracks,1970s,"album rock, blues rock, classic rock, hard rock, rock",65.0
,I'll Be Seeing You,Billie Holiday,1957,Artist Top Tracks,1950s,"adult standards, harlem renaissance, jazz, jazz blues, soul, swing, torch song, vocal jazz",65.0
,Blue Moon,Billie Holiday,1956,Artist Top Tracks,1950s,"adult standards, harlem renaissance, jazz, jazz blues, soul, swing, torch song, vocal jazz",65.0
,Winter Wonderland,Dean Martin,1959,Artist Top Tracks,1950s,"adult standards, easy listening, lounge, vocal jazz",65.0
,Adeste Fideles,Nat King Cole,1962,Artist Top Tracks,1960s,"adult standards, easy listening, lounge, soul, swing, vocal jazz",65.0
,Dream A Little Dream Of Me,Louis Armstrong,1968,Artist Top Tracks,1960s,"adult standards, dixieland, harlem renaissance, jazz trumpet, lounge, new orleans jazz, soul, swing, vocal jazz",65.0
,Monastery,Ryan Castro,2021,Artist Top Tracks,2020s,"reggaeton, trap colombiano, trap latino, urbano latino",64.0
,Residuals,Chris Brown,2024,Artist Top Tracks,2020s,"r&b, rap",64.0
,Tick Tock (feat. 24kGoldn),Clean Bandit,2020,Artist Top Tracks,2020s,"pop, uk dance, uk funky",64.0
,Rather Be (feat. Jess Glynne),Clean Bandit,2014,Artist Top Tracks,2010s,"pop, uk dance, uk funky",64.0
,Halo,Beyoncé,2008,Artist Top Tracks,2000s,"pop, r&b",64.0
,Un-thinkable (I'm Ready),Alicia Keys,2009,Artist Top Tracks,2000s,"neo soul, pop, r&b",64.0
,"Baby, It's Cold Outside (feat. Kelly Clarkson)",John Legend,2018,Artist Top Tracks,2010s,"neo soul, pop, pop soul, urban contemporary",64.0
,ABC,The Jackson 5,1970,Artist Top Tracks,1970s,"motown, soul",64.0
,Circles,Pierce The Veil,2016,Artist Top Tracks,2010s,"modern rock, pop punk, screamo",64.0
,Bulletproof Love,Pierce The Veil,2010,Artist Top Tracks,2010s,"modern rock, pop punk, screamo",64.0
,There's the Sun,Zach Top,2024,Artist Top Tracks,2020s,modern country pop,64.0
,Beer For Breakfast,Zach Top,2024,Artist Top Tracks,2020s,modern country pop,64.0
,Cowboys Like Me Do,Zach Top,2024,Artist Top Tracks,2020s,modern country pop,64.0
,X'CLUSIVO - REMIX,Gonzy,2024,Artist Top Tracks,2020s,"latin hip hop, reggaeton, trap latino, urbano latino",64.0
,Bandoleros,Don Omar,2024,Artist Top Tracks,2020s,"latin hip hop, puerto rican pop, reggaeton, trap latino, urbano latino",64.0
,In Your Love,Tyler Childers,2023,Artist Top Tracks,2020s,"kentucky indie, kentucky roots, outlaw country",64.0
,Savior Complex,Phoebe Bridgers,2020,Artist Top Tracks,2020s,"indie pop, la indie, pov: indie",64.0
,Graceland Too,Phoebe Bridgers,2020,Artist Top Tracks,2020s,"indie pop, la indie, pov: indie",64.0
,Sweet Heat Lightning,Gregory Alan Isakov,2023,Artist Top Tracks,2020s,"indie folk, pop folk, stomp and flutter, stomp and holler",64.0
,Lollipop,Lil Wayne,2008,Artist Top Tracks,2000s,"hip hop, new orleans rap, pop rap, rap, trap",64.0
,Fuel,Metallica,1997,Artist Top Tracks,1990s,"hard rock, metal, old school thrash, rock, thrash metal",64.0
,Sad But True (Remastered),Metallica,1991,Artist Top Tracks,1990s,"hard rock, metal, old school thrash, rock, thrash metal",64.0
,Hail Mary,2Pac,1998,Artist Top Tracks,1990s,"g funk, gangster rap, hip hop, rap, west coast rap",64.0
,The Automotivo Infernal 1.0 - Purple,MRL,2023,Artist Top Tracks,2020s,"funk carioca, funk mtg, funk paulista, funk rj",64.0
,Angela,The Lumineers,2016,Artist Top Tracks,2010s,"folk-pop, modern rock, neo mellow, stomp and holler",64.0
,I'm with You,Vance Joy,2018,Artist Top Tracks,2010s,"folk-pop, modern rock",64.0
,Fire and the Flood,Vance Joy,2014,Artist Top Tracks,2010s,"folk-pop, modern rock",64.0
,Love's Train,Bruno Mars,2021,Artist Top Tracks,2020s,"escape room, hip hop, indie soul, neo soul",64.0
,Vale,Maribou State,2018,Artist Top Tracks,2010s,"electronica, future garage, indie soul",64.0
,I Started A Joke,Bee Gees,1968,Artist Top Tracks,1960s,"disco, mellow gold, soft rock",64.0
,Ain't Nobody,Rufus,1983,Artist Top Tracks,1980s,"disco, funk, neo soul, quiet storm, soul",64.0
,I'm Every Woman,Chaka Khan,1978,Artist Top Tracks,1970s,"disco, funk, neo soul, quiet storm, soul",64.0
,"World, Hold On - FISHER Rework",Bob Sinclar,2022,Artist Top Tracks,2020s,"disco house, filter house",64.0
,For Life (feat. Nile Rodgers),Kygo,2024,Artist Top Tracks,2020s,disco,64.0
,I Was Made For Lovin' You (feat. Nile Rodgers & House Gospel Choir),Oliver Heldens,2022,Artist Top Tracks,2020s,disco,64.0
,What Do They Know?,Mindless Self Indulgence,2005,Artist Top Tracks,2000s,"dance-punk, pov: indie",64.0
,Those Sweet Words,Norah Jones,2004,Artist Top Tracks,2000s,"contemporary vocal jazz, jazz pop, neo mellow, vocal jazz",64.0
,Indifferent,Megan Moroney,2024,Artist Top Tracks,2020s,"contemporary country, modern country pop",64.0
,Mama I Lied,Megan Moroney,2024,Artist Top Tracks,2020s,"contemporary country, modern country pop",64.0
,Hell or High Water (From Twisters: The Album),Bailey Zimmerman,2024,Artist Top Tracks,2020s,"contemporary country, modern country pop",64.0
,Jesus Saves,Riley Green,2024,Artist Top Tracks,2020s,"contemporary country, modern country pop",64.0
,Big Green Tractor,Jason Aldean,2009,Artist Top Tracks,2000s,"contemporary country, country, country road, modern country rock",64.0
,Here For A Good Time,George Strait,2011,Artist Top Tracks,2010s,"contemporary country, country, country road",64.0
,Why We Thugs,Ice Cube,2006,Artist Top Tracks,2000s,"conscious hip hop, g funk, gangster rap, hip hop, rap, west coast rap",64.0
,Electric Relaxation,A Tribe Called Quest,1999,Artist Top Tracks,1990s,"conscious hip hop, east coast hip hop, golden age hip hop, hip hop, jazz rap, queens hip hop",64.0
,DE LUNES A LUNES,Manuel Turizo,2024,Artist Top Tracks,2020s,"colombian pop, latin pop, reggaeton, reggaeton colombiano, trap latino, urbano latino",64.0
,9,Dean Blunt,2020,Artist Top Tracks,2020s,"collage pop, hypnagogic pop, uk experimental electronic",64.0
,100,Dean Blunt,2014,Artist Top Tracks,2010s,"collage pop, hypnagogic pop, uk experimental electronic",64.0
,"Suite bergamasque, L. 75: III. Clair de lune",Claude Debussy,2018,Artist Top Tracks,2010s,"classical, impressionism, post-romantic era",64.0
,"Clair de Lune, L. 32",Claude Debussy,1994,Artist Top Tracks,1990s,"classical, impressionism, post-romantic era",64.0
,"Chopin: Nocturne No. 20 in C-Sharp Minor, Op. Posth.",Frédéric Chopin,2000,Artist Top Tracks,2000s,"classical, early romantic era, polish classical",64.0
,Perfect Symphony (Ed Sheeran & Andrea Bocelli),Ed Sheeran,2017,Artist Top Tracks,2010s,"classical tenor, italian tenor, operatic pop",64.0
,Welcome to the Show,Cody Johnson,2019,Artist Top Tracks,2010s,"classic texas country, contemporary country, modern country pop",64.0
,Deeper Well,Kacey Musgraves,2024,Artist Top Tracks,2020s,"classic texas country, contemporary country, country dawn",64.0
,A Change Is Gonna Come,Sam Cooke,2003,Artist Top Tracks,2000s,"classic soul, soul, vocal jazz",64.0
,Merry Christmas Baby,Otis Redding,1968,Artist Top Tracks,1960s,"classic soul, memphis soul, soul, soul blues, southern soul, vocal jazz",64.0
,Stand by Me,Otis Redding,1964,Artist Top Tracks,1960s,"classic soul, memphis soul, soul, soul blues, southern soul, vocal jazz",64.0
,These Arms of Mine,Otis Redding,1964,Artist Top Tracks,1960s,"classic soul, memphis soul, soul, soul blues, southern soul, vocal jazz",64.0
,I'll Be Around,The Spinners,1973,Artist Top Tracks,1970s,"classic soul, disco, funk, motown, philly soul, quiet storm, soul, southern soul",64.0
,It's A Shame,The Spinners,1970,Artist Top Tracks,1970s,"classic soul, disco, funk, motown, philly soul, quiet storm, soul, southern soul",64.0
,Moondance - 2013 Remaster,Van Morrison,1970,Artist Top Tracks,1970s,"classic rock, folk, folk rock, mellow gold, rock, singer-songwriter, soft rock",64.0
,Hurricane,Bob Dylan,1976,Artist Top Tracks,1970s,"classic rock, country rock, folk, folk rock, rock, roots rock, singer-songwriter",64.0
,I’ll Have to Say I Love You in a Song,Jim Croce,1973,Artist Top Tracks,1970s,"classic rock, country rock, folk, folk rock, mellow gold, singer-songwriter, soft rock",64.0
,Jingle Bell Rock,Blake Shelton,2012,Artist Top Tracks,2010s,"classic oklahoma country, contemporary country, country, country road",64.0
,Winter Wonderland,Blake Shelton,2012,Artist Top Tracks,2010s,"classic oklahoma country, contemporary country, country, country road",64.0
,Rocky Mountain High,John Denver,1972,Artist Top Tracks,1970s,"classic country pop, folk, folk rock, mellow gold, singer-songwriter, soft rock",64.0
,"The Carnival of the Animals, R. 125: XIII. The Swan (Arr. for Cello and Piano)",Camille Saint-Saëns,2015,Artist Top Tracks,2010s,"chamber ensemble, classical cello, classical performance",64.0
,"WHATS POPPIN (feat. DaBaby, Tory Lanez & Lil Wayne) - Remix",Jack Harlow,2020,Artist Top Tracks,2020s,"canadian hip hop, canadian trap, melodic rap, pop rap, r&b, rap, trap",64.0
,Escape (feat. Hayla),Kx5,2023,Artist Top Tracks,2020s,"canadian electronic, complextro, edm, electro house, pop dance, progressive electro house, progressive house",64.0
,Dear Theodosia,Leslie Odom Jr.,2015,Artist Top Tracks,2010s,"broadway, show tunes, vocal jazz",64.0
,Pearls,Sade,1992,Artist Top Tracks,1990s,"british soul, sophisti-pop",64.0
,The Sweetest Taboo,Sade,1985,Artist Top Tracks,1980s,"british soul, sophisti-pop",64.0
,Maria Maria (feat. The Product G&B),Santana,1999,Artist Top Tracks,1990s,"blues rock, classic rock, mexican classic rock",64.0
,Wild Child,The Black Keys,2022,Artist Top Tracks,2020s,"alternative rock, blues rock, garage rock, indie rock, indietronica, modern blues rock, modern rock, punk blues, rock",64.0
,Fever,The Black Keys,2014,Artist Top Tracks,2010s,"alternative rock, blues rock, garage rock, indie rock, indietronica, modern blues rock, modern rock, punk blues, rock",64.0
,Once in a Lifetime - 2005 Remaster,Talking Heads,1980,Artist Top Tracks,1980s,"alternative rock, art punk, dance rock, funk rock, new wave, permanent wave, post-punk, rock, zolo",64.0
,What It Is (Block Boy) (with Kodak Black),Doechii,2023,Artist Top Tracks,2020s,alternative r&b,64.0
,Mona Lisa,Dominic Fike,2023,Artist Top Tracks,2020s,"alternative pop rock, pov: indie",64.0
,ZOMBIFIED,Falling In Reverse,2024,Artist Top Tracks,2020s,"alternative metal, rap metal",64.0
,Hit That,The Offspring,2003,Artist Top Tracks,2000s,"alternative metal, permanent wave, post-grunge, punk, rock, skate punk, socal pop punk",64.0
,Dammit,blink-182,1997,Artist Top Tracks,1990s,"alternative metal, modern rock, pop punk, punk, rock, socal pop punk",64.0
,"Swing, Swing",The All-American Rejects,2002,Artist Top Tracks,2000s,"alternative metal, modern rock, neo mellow, neon pop punk, pop punk, pop rock, post-grunge",64.0
,"I'm Made Of Wax, Larry, What Are You Made Of?",A Day To Remember,2009,Artist Top Tracks,2000s,"alternative metal, metalcore, neon pop punk, pop punk, screamo",64.0
,Faith,Limp Bizkit,1997,Artist Top Tracks,1990s,"alternative metal, funk metal, nu metal, post-grunge, rap metal, rock",64.0
,Still Waiting,Sum 41,2002,Artist Top Tracks,2000s,"alternative metal, canadian pop punk, canadian punk, modern rock, pop punk, post-grunge, punk, rock",64.0
,Walk,Foo Fighters,2011,Artist Top Tracks,2010s,"alternative metal, alternative rock, modern rock, permanent wave, post-grunge, rock",64.0
,Today,The Smashing Pumpkins,2001,Artist Top Tracks,2000s,"alternative metal, alternative rock, grunge, permanent wave, rock, spacegrunge",64.0
,Mayonaise - 2011 Remaster,The Smashing Pumpkins,1993,Artist Top Tracks,1990s,"alternative metal, alternative rock, grunge, permanent wave, rock, spacegrunge",64.0
,Luna - 2011 Remaster,The Smashing Pumpkins,1993,Artist Top Tracks,1990s,"alternative metal, alternative rock, grunge, permanent wave, rock, spacegrunge",64.0
,Sleep Now In the Fire,Rage Against The Machine,1999,Artist Top Tracks,1990s,"alternative metal, alternative rock, conscious hip hop, funk metal, hard rock, nu metal, political hip hop, post-grunge, rap metal, rap rock, rock",64.0
,New Gold (feat. Tame Impala and Bootie Brown),Gorillaz,2023,Artist Top Tracks,2020s,"alternative hip hop, modern rock, rock",64.0
,D.A.N.C.E,Justice,2007,Artist Top Tracks,2000s,"alternative dance, dance-punk, electronica, filter house, indietronica, new rave",64.0
,Only A Fool Would Say That,Steely Dan,1972,Artist Top Tracks,1970s,"album rock, classic rock, country rock, folk rock, mellow gold, rock, soft rock, yacht rock",64.0
,Tears in Heaven - Acoustic Live,Eric Clapton,1992,Artist Top Tracks,1990s,"album rock, blues rock, classic rock, electric blues, mellow gold, rock, singer-songwriter, soft rock",64.0
,Solitude,Billie Holiday,1956,Artist Top Tracks,1950s,"adult standards, harlem renaissance, jazz, jazz blues, soul, swing, torch song, vocal jazz",64.0
,Silver Bells (feat. Count Basie Big Band),Tony Bennett,2008,Artist Top Tracks,2000s,"adult standards, easy listening, lounge, vocal jazz",64.0
,"Hallelujah, I Love Her So",Ray Charles,1957,Artist Top Tracks,1950s,"adult standards, classic soul, jazz blues, piano blues, soul, soul blues, vocal jazz",64.0
,Mujeriego,Ryan Castro,2022,Artist Top Tracks,2020s,"reggaeton, trap colombiano, trap latino, urbano latino",63.0
,pa la europa,FloyyMenor,2023,Artist Top Tracks,2020s,reggaeton chileno,63.0
,un star,FloyyMenor,2023,Artist Top Tracks,2020s,reggaeton chileno,63.0
,Sure Thing - Sped Up,Miguel,2023,Artist Top Tracks,2020s,"r&b, urban contemporary",63.0
,I Miss You (feat. Julia Michaels),Clean Bandit,2018,Artist Top Tracks,2010s,"pop, uk dance, uk funky",63.0
,Change,Alex G,2012,Artist Top Tracks,2010s,"philly indie, pov: indie, slacker rock",63.0
,Forever,Alex G,2012,Artist Top Tracks,2010s,"philly indie, pov: indie, slacker rock",63.0
,Alone,The Cure,2024,Artist Top Tracks,2020s,"new wave, permanent wave, rock, uk post-punk",63.0
,A Fragile Thing,The Cure,2024,Artist Top Tracks,2020s,"new wave, permanent wave, rock, uk post-punk",63.0
,Lovesong - 2010 Remaster,The Cure,1989,Artist Top Tracks,1980s,"new wave, permanent wave, rock, uk post-punk",63.0
,It's Beginning to Look a Lot Like Christmas - Piano Version,Henry Smith,2020,Artist Top Tracks,2020s,neo-classical,63.0
,One Hundred Sleepless Nights,Pierce The Veil,2012,Artist Top Tracks,2010s,"modern rock, pop punk, screamo",63.0
,A Bar Song (Tipsy) [Remix},Shaboozey,2024,Artist Top Tracks,2020s,"modern country pop, pop rap",63.0
,The Kinda Woman I Like,Zach Top,2024,Artist Top Tracks,2020s,modern country pop,63.0
,Safari Song,Greta Van Fleet,2017,Artist Top Tracks,2010s,"modern blues rock, modern hard rock, rock",63.0
,Social Cues,Cage The Elephant,2019,Artist Top Tracks,2010s,"modern alternative rock, modern rock, pov: indie, punk blues, rock",63.0
,Hace Mucho Tiempo,Arcángel,2013,Artist Top Tracks,2010s,"latin hip hop, reggaeton, trap latino, urbano latino",63.0
,Skating,Vince Guaraldi Trio,2012,Artist Top Tracks,2010s,jazz trio,63.0
,Kyoto,Phoebe Bridgers,2020,Artist Top Tracks,2020s,"indie pop, la indie, pov: indie",63.0
,No Sleep,Caamp,2019,Artist Top Tracks,2010s,"indie folk, stomp and holler",63.0
,All the Debts I Owe,Caamp,2016,Artist Top Tracks,2010s,"indie folk, stomp and holler",63.0
,Meet Me in the Woods,Lord Huron,2015,Artist Top Tracks,2010s,"indie folk, stomp and holler",63.0
,Before the Sun,Gregory Alan Isakov,2023,Artist Top Tracks,2020s,"indie folk, pop folk, stomp and flutter, stomp and holler",63.0
,A Milli,Lil Wayne,2008,Artist Top Tracks,2000s,"hip hop, new orleans rap, pop rap, rap, trap",63.0
,The Unforgiven (Remastered),Metallica,1991,Artist Top Tracks,1990s,"hard rock, metal, old school thrash, rock, thrash metal",63.0
,Seek & Destroy (Remastered),Metallica,1983,Artist Top Tracks,1980s,"hard rock, metal, old school thrash, rock, thrash metal",63.0
,6 In the Morning (feat. Nate Dogg),Flex (UK),2024,Artist Top Tracks,2020s,"g funk, gangster rap, hardcore hip hop, hip hop, west coast rap",63.0
,Joga Pra Lua,Anitta,2024,Artist Top Tracks,2020s,"funk pop, funk rj, pagode baiano, pop, pop nacional",63.0
,Unfinished Sympathy - 2012 Mix/Master,Massive Attack,1991,Artist Top Tracks,1990s,"downtempo, electronica, trip hop",63.0
,Get Down On It,Kool & The Gang,1981,Artist Top Tracks,1980s,"disco, funk, motown, soft rock, soul",63.0
,After the Love Has Gone,"Earth, Wind & Fire",1979,Artist Top Tracks,1970s,"disco, funk, jazz funk, motown, soul",63.0
,Honey Boy (feat. Nile Rodgers & Shenseea),Purple Disco Machine,2024,Artist Top Tracks,2020s,disco,63.0
,This Hurts,Mindless Self Indulgence,2015,Artist Top Tracks,2010s,"dance-punk, pov: indie",63.0
,Molly,Mindless Self Indulgence,2011,Artist Top Tracks,2010s,"dance-punk, pov: indie",63.0
,Christmas Calling (Jolly Jones),Norah Jones,2022,Artist Top Tracks,2020s,"contemporary vocal jazz, jazz pop, neo mellow, vocal jazz",63.0
,Third Time's the Charm,Megan Moroney,2024,Artist Top Tracks,2020s,"contemporary country, modern country pop",63.0
,All I Want for Christmas is a Cowboy,Megan Moroney,2024,Artist Top Tracks,2020s,"contemporary country, modern country pop",63.0
,Someone In This Room (feat. Bailey Zimmerman),Jessie Murph,2024,Artist Top Tracks,2020s,"contemporary country, modern country pop",63.0
,Change My Mind,Riley Green,2024,Artist Top Tracks,2020s,"contemporary country, modern country pop",63.0
,When She Comes Home Tonight,Riley Green,2018,Artist Top Tracks,2010s,"contemporary country, modern country pop",63.0
,Try That In A Small Town,Jason Aldean,2023,Artist Top Tracks,2020s,"contemporary country, country, country road, modern country rock",63.0
,If I Didn’t Love You,Jason Aldean,2021,Artist Top Tracks,2020s,"contemporary country, country, country road, modern country rock",63.0
,Drunk On You,Luke Bryan,2011,Artist Top Tracks,2010s,"contemporary country, country, country road, modern country rock",63.0
,The Truth,Jason Aldean,2009,Artist Top Tracks,2000s,"contemporary country, country, country road, modern country rock",63.0
,Give It Away,George Strait,2006,Artist Top Tracks,2000s,"contemporary country, country, country road",63.0
,All My Ex's Live In Texas,George Strait,1987,Artist Top Tracks,1980s,"contemporary country, country, country road",63.0
,You Can Do It,Ice Cube,2000,Artist Top Tracks,2000s,"conscious hip hop, g funk, gangster rap, hip hop, rap, west coast rap",63.0
,Adieux,Ludovico Einaudi,2024,Artist Top Tracks,2020s,"compositional ambient, neo-classical",63.0
,"Nocturne No. 2 in E-Flat Major, Op. 9 No. 2",Frédéric Chopin,1982,Artist Top Tracks,1980s,"classical, early romantic era, polish classical",63.0
,"Bagatelle No. 25 in A Minor, WoO 59 ""Für Elise""",Ludwig van Beethoven,2015,Artist Top Tracks,2010s,"classical, classical era, early romantic era, german romanticism",63.0
,Butterflies,Kacey Musgraves,2018,Artist Top Tracks,2010s,"classic texas country, contemporary country, country dawn",63.0
,Rainbow,Kacey Musgraves,2018,Artist Top Tracks,2010s,"classic texas country, contemporary country, country dawn",63.0
,Got To Give It Up - Pt. 1,Marvin Gaye,1983,Artist Top Tracks,1980s,"classic soul, motown, neo soul, northern soul, quiet storm, soul",63.0
,Think,Aretha Franklin,1968,Artist Top Tracks,1960s,"classic soul, jazz blues, memphis soul, soul, southern soul, vocal jazz",63.0
,Use Me,Bill Withers,1972,Artist Top Tracks,1970s,"classic soul, funk, quiet storm, soul",63.0
,The Times They Are A-Changin',Bob Dylan,1964,Artist Top Tracks,1960s,"classic rock, country rock, folk, folk rock, rock, roots rock, singer-songwriter",63.0
,I Got a Name (Stereo Version),Jim Croce,1973,Artist Top Tracks,1970s,"classic rock, country rock, folk, folk rock, mellow gold, singer-songwriter, soft rock",63.0
,God's Country,Blake Shelton,2019,Artist Top Tracks,2010s,"classic oklahoma country, contemporary country, country, country road",63.0
,Rudolph the Red Nosed Reindeer,John Denver,1975,Artist Top Tracks,1970s,"classic country pop, folk, folk rock, mellow gold, singer-songwriter, soft rock",63.0
,Thank God I'm a Country Boy,John Denver,1974,Artist Top Tracks,1970s,"classic country pop, folk, folk rock, mellow gold, singer-songwriter, soft rock",63.0
,crushcrushcrush,Paramore,2007,Artist Top Tracks,2000s,"candy pop, modern rock, pixie, pop, pop emo, pop punk, rock",63.0
,A Winter's Ball,Leslie Odom Jr.,2015,Artist Top Tracks,2010s,"broadway, show tunes, vocal jazz",63.0
,Is It a Crime,Sade,1985,Artist Top Tracks,1980s,"british soul, sophisti-pop",63.0
,No Particular Place To Go,Chuck Berry,1964,Artist Top Tracks,1960s,"blues, blues rock, classic rock, rock, rock-and-roll, rockabilly, soul",63.0
,Oye Como Va,Santana,1970,Artist Top Tracks,1970s,"blues rock, classic rock, mexican classic rock",63.0
,I Came Thru,YoungBoy Never Broke Again,2018,Artist Top Tracks,2010s,"baton rouge rap, rap",63.0
,No. 9,YoungBoy Never Broke Again,2017,Artist Top Tracks,2010s,"baton rouge rap, rap",63.0
,The Flower Garden,Joe Hisaishi,2004,Artist Top Tracks,2000s,"anime, anime score, japanese classical, japanese soundtrack, orchestral soundtrack",63.0
,Avril 14th,Aphex Twin,2001,Artist Top Tracks,2000s,"ambient, braindance, electronica, intelligent dance music, uk experimental electronic",63.0
,Hash Pipe,Weezer,2001,Artist Top Tracks,2000s,"alternative rock, modern power pop, modern rock, permanent wave, rock",63.0
,Tighten Up,The Black Keys,2010,Artist Top Tracks,2010s,"alternative rock, blues rock, garage rock, indie rock, indietronica, modern blues rock, modern rock, punk blues, rock",63.0
